{
  "metadata": {
    "name": "GanbaruAI default skill tree",
    "version": "1.0.0",
    "description": "General-purpose radial DAG skill tree template covering 7 life/work domains. Designed as the default tree for all new users. 150 nodes, 7 branches, 5 depth levels, 12 cross-branch connections. Based on Path of Exile's three-tier node hierarchy, FFX Sphere Grid's progressive disclosure, and Maker Skill Trees' domain-specific structure.",
    "total_nodes": 150,
    "max_depth": 5,
    "design_notes": {
      "node_tiers": "basic (small, connective tissue, easy to unlock), notable (medium, named landmarks, harder), keystone (large, transformative, require cross-branch mastery)",
      "cross_branch_types": "bridge (boundary between two branches), multi_parent (prerequisites from 2+ branches), synergy (hidden until prerequisites from different branches are both met)",
      "progressive_disclosure": "Show only unlocked nodes + immediate neighbors. Fade nodes 2+ steps away. Semantic zoom: zoomed out = branch clusters with completion %, zoomed in = individual nodes with details.",
      "max_choices_per_node": "3-5 next options visible at any node to avoid paradox of choice",
      "decay_formula": "displayed_level = actual_level * e^(-0.03 * days_since_practice)",
      "xp_curve": "XP_required = (level / calibration_factor)^2, calibrated so lvl 1->2 ≈ 1 productive day (~200 XP), lvl 49->50 ≈ 2 weeks"
    }
  },

  "branches": [
    {
      "id": "health",
      "name": "Health & Vitality",
      "color": "#4CAF50",
      "icon": "heart-pulse",
      "description": "Physical fitness, nutrition, mental wellness, and recovery. The foundation that supports every other branch.",
      "radial_position_degrees": 0
    },
    {
      "id": "career",
      "name": "Career & Craft",
      "color": "#2196F3",
      "icon": "briefcase",
      "description": "Technical skills, professional growth, and industry knowledge. The domain of your primary work.",
      "radial_position_degrees": 51
    },
    {
      "id": "knowledge",
      "name": "Knowledge & Learning",
      "color": "#9C27B0",
      "icon": "book-open",
      "description": "Sciences, humanities, languages, and research. The pursuit of understanding.",
      "radial_position_degrees": 103
    },
    {
      "id": "creative",
      "name": "Creative Expression",
      "color": "#FF9800",
      "icon": "palette",
      "description": "Writing, visual arts, music, and digital creation. The domain of making things that didn't exist before.",
      "radial_position_degrees": 154
    },
    {
      "id": "social",
      "name": "Social & Communication",
      "color": "#F44336",
      "icon": "users",
      "description": "Communication, relationships, leadership, and teaching. How you connect with and influence others.",
      "radial_position_degrees": 206
    },
    {
      "id": "financial",
      "name": "Financial Acumen",
      "color": "#FFC107",
      "icon": "coins",
      "description": "Personal finance, investing, and business. Turning effort into sustainable resources.",
      "radial_position_degrees": 257
    },
    {
      "id": "inner",
      "name": "Inner Growth",
      "color": "#3F51B5",
      "icon": "flame",
      "description": "Self-discipline, emotional intelligence, philosophy, and habit formation. The invisible infrastructure of personal power.",
      "radial_position_degrees": 309
    }
  ],

  "nodes": [

    {
      "id": "origin",
      "name": "You",
      "description": "The center of your skill tree. Not a skill — your identity. All branches radiate from here.",
      "branch": null,
      "level": 0,
      "tier": "origin",
      "prerequisites": [],
      "tags": [],
      "xp_to_unlock": 0,
      "flavor_text": "Every journey begins at the center."
    },


    {
      "id": "hlth_root",
      "name": "Health & Vitality",
      "description": "Begin investing in your physical and mental foundation. Unlocks all Health sub-branches.",
      "branch": "health",
      "level": 1,
      "tier": "notable",
      "prerequisites": ["origin"],
      "tags": ["health", "foundation"],
      "xp_to_unlock": 0,
      "flavor_text": "The body is the instrument through which all other skills are expressed."
    },
    {
      "id": "hlth_fitness",
      "name": "Physical Fitness",
      "description": "Structured physical training. Covers cardio, strength, and flexibility as sub-paths.",
      "branch": "health",
      "level": 2,
      "tier": "notable",
      "prerequisites": ["hlth_root"],
      "tags": ["health", "fitness", "discipline"],
      "xp_to_unlock": 100,
      "flavor_text": "The first step is always the hardest — but only the first time."
    },
    {
      "id": "hlth_nutrition",
      "name": "Nutrition",
      "description": "Understanding what fuels your body and building sustainable eating patterns.",
      "branch": "health",
      "level": 2,
      "tier": "basic",
      "prerequisites": ["hlth_root"],
      "tags": ["health", "nutrition", "self-care"],
      "xp_to_unlock": 75,
      "flavor_text": "You cannot outwork a bad diet."
    },
    {
      "id": "hlth_mental",
      "name": "Mental Wellness",
      "description": "Stress management, mindfulness, and psychological resilience practices.",
      "branch": "health",
      "level": 2,
      "tier": "notable",
      "prerequisites": ["hlth_root"],
      "tags": ["health", "mental-health", "mindfulness"],
      "xp_to_unlock": 100,
      "flavor_text": "The mind is a muscle that atrophies without care."
    },
    {
      "id": "hlth_rest",
      "name": "Rest & Recovery",
      "description": "Sleep optimization, active recovery, and understanding the role of downtime in performance.",
      "branch": "health",
      "level": 2,
      "tier": "basic",
      "prerequisites": ["hlth_root"],
      "tags": ["health", "recovery", "sleep"],
      "xp_to_unlock": 75,
      "flavor_text": "Growth happens during rest, not during strain."
    },
    {
      "id": "hlth_cardio",
      "name": "Cardiovascular Endurance",
      "description": "Running, cycling, swimming, or any sustained aerobic activity. Build your baseline stamina.",
      "branch": "health",
      "level": 3,
      "tier": "basic",
      "prerequisites": ["hlth_fitness"],
      "tags": ["health", "fitness", "endurance"],
      "xp_to_unlock": 150,
      "flavor_text": "One more kilometer. Then one more."
    },
    {
      "id": "hlth_strength",
      "name": "Strength Training",
      "description": "Resistance training with progressive overload. Compound movements, form, and programming.",
      "branch": "health",
      "level": 3,
      "tier": "basic",
      "prerequisites": ["hlth_fitness"],
      "tags": ["health", "fitness", "strength"],
      "xp_to_unlock": 150,
      "flavor_text": "Iron doesn't judge. It only asks: can you lift it?"
    },
    {
      "id": "hlth_flexibility",
      "name": "Flexibility & Mobility",
      "description": "Stretching routines, joint mobility work, and injury prevention through range-of-motion training.",
      "branch": "health",
      "level": 3,
      "tier": "basic",
      "prerequisites": ["hlth_fitness"],
      "tags": ["health", "fitness", "flexibility"],
      "xp_to_unlock": 150,
      "flavor_text": "The oak resists the wind and breaks. The reed bends and survives."
    },
    {
      "id": "hlth_mealprep",
      "name": "Meal Planning",
      "description": "Weekly meal preparation, grocery strategy, and building repeatable healthy eating systems.",
      "branch": "health",
      "level": 3,
      "tier": "basic",
      "prerequisites": ["hlth_nutrition"],
      "tags": ["health", "nutrition", "planning"],
      "xp_to_unlock": 150,
      "flavor_text": "Discipline is deciding what to eat before you're hungry."
    },
    {
      "id": "hlth_nutrisci",
      "name": "Nutritional Science",
      "description": "Macronutrients, micronutrients, caloric balance, and evidence-based dietary knowledge.",
      "branch": "health",
      "level": 3,
      "tier": "basic",
      "prerequisites": ["hlth_nutrition"],
      "tags": ["health", "nutrition", "science"],
      "xp_to_unlock": 150,
      "flavor_text": "Know what you consume and why."
    },
    {
      "id": "hlth_stress",
      "name": "Stress Management",
      "description": "Identifying stressors, coping strategies, breathing techniques, and building stress tolerance.",
      "branch": "health",
      "level": 3,
      "tier": "basic",
      "prerequisites": ["hlth_mental"],
      "tags": ["health", "mental-health", "resilience"],
      "xp_to_unlock": 150,
      "flavor_text": "Pressure makes diamonds — but only if you don't shatter first."
    },
    {
      "id": "hlth_mindful",
      "name": "Mindfulness Practice",
      "description": "Regular meditation, body scanning, present-moment awareness, and attention training.",
      "branch": "health",
      "level": 3,
      "tier": "basic",
      "prerequisites": ["hlth_mental"],
      "tags": ["health", "mental-health", "mindfulness", "focus"],
      "xp_to_unlock": 150,
      "flavor_text": "Silence the noise. What remains is you."
    },
    {
      "id": "hlth_sleep",
      "name": "Sleep Optimization",
      "description": "Consistent sleep schedule, environment optimization, and tracking sleep quality patterns.",
      "branch": "health",
      "level": 3,
      "tier": "basic",
      "prerequisites": ["hlth_rest"],
      "tags": ["health", "sleep", "recovery"],
      "xp_to_unlock": 150,
      "flavor_text": "The secret weapon of every high performer is eight hours of unconsciousness."
    },
    {
      "id": "hlth_active_recovery",
      "name": "Active Recovery",
      "description": "Low-intensity movement on rest days, foam rolling, cold/heat therapy, and deload strategies.",
      "branch": "health",
      "level": 3,
      "tier": "basic",
      "prerequisites": ["hlth_rest"],
      "tags": ["health", "recovery", "fitness"],